{
  "schema_version": "0.1",
  "exchange_id": "hx-emg-001",
  "kind": "EMERGENCY_ACTION",
  "parties": {
    "initiator": {
      "id": "kit",
      "role": "HELPER",
      "standing": "SELF"
    },
    "counterparty": {
      "id": "ada",
      "role": "HELPED",
      "standing": "SELF"
    }
  },
  "capability": "Pulled ada's laptop off a failing power strip.",
  "evidence": {
    "known": [
      "smoke from the strip"
    ],
    "unknown": [
      "whether the disk was mid-write"
    ]
  },
  "emergency": {
    "authority_basis": "none conferred; acted on immediate physical risk",
    "necessity_basis": "ada was not in the room and delay risked fire",
    "residue": "tell ada today, replace the strip, ada decides whether anything of mine is touched again",
    "voluntary": false
  },
  "history": [
    {
      "to": "TAKEN",
      "actor": "kit",
      "at_utc": "2026-09-01T14:00:00Z",
      "basis": "kit acted"
    },
    {
      "to": "NOTIFIED",
      "actor": "kit",
      "at_utc": "2026-09-01T14:20:00Z",
      "basis": "kit told ada what he did"
    }
  ]
}